{
 "schemaVersion": 1,
 "updatedAt": "2026-08-28T19:31:50+09:00",
 "overall": {
  "races": 23,
  "winHits": 6,
  "winRate": 0.2609,
  "placeHits": 13,
  "placeRate": 0.5652,
  "top3ExactHits": 0
 },
 "byTrack": {
  "seoul": {
   "races": 4,
   "winHits": 2,
   "winRate": 0.5,
   "placeHits": 4,
   "placeRate": 1.0,
   "top3ExactHits": 0
  },
  "busan": {
   "races": 12,
   "winHits": 2,
   "winRate": 0.1667,
   "placeHits": 3,
   "placeRate": 0.25,
   "top3ExactHits": 0
  },
  "jeju": {
   "races": 7,
   "winHits": 2,
   "winRate": 0.2857,
   "placeHits": 6,
   "placeRate": 0.8571,
   "top3ExactHits": 0
  }
 },
 "history": [
  {
   "date": "2026-08-16",
   "races": 8,
   "winHits": 3,
   "placeHits": 5
  },
  {
   "date": "2026-08-28",
   "races": 15,
   "winHits": 3,
   "placeHits": 8
  }
 ]
}
